id,review,category,kw_handicap,kw_pet,kw_child,bert_handicap,bert_pet,bert_child,validation_status
5913,"We love this pet friendly, oceanfront property. The staff is very friendly and accommodating. Close to local restaurants, services. Beautiful maintained paths along oceanfront make for great sights including whales and sea lions.",pet,0,1,0,0,0,0,disputed
1718,"No surprises here, a great stay at this Courtyard! We were in town for 2 days prior to boarding our cruise and we loved our stay. For two adults, a child and a senior everyone was happy. The room was clean and nice size. The view of Lake Union from our room was beautiful and the location was great! Gym, great for the stay!Food in the restaurant, served its purpose and great to be on site!Service, fantasic!Very Happy with this stay!Thank you so much for your wonderful review! We are so happy to hear you enjoyed your stay with us before your cruise and hope to see you next time your travels bring you to Seattle!Sincerely,Rachel Packard",child,0,0,1,0,0,0,disputed
8658,"Weekend getaway with children.  Hotel is very nice and clean.  Easy access to shopping and activities, especially when weather is not best - love having the ""link"" walkway to Union Station and Crown Center shopping.",child,0,0,1,0,0,0,disputed
9307,"Conveniently located near FLL airport, free airport transportation, shuttle provided. Free Breakfast and WiFi. Great Service. Definitely will use this service again and recommend to my friends and family. Also, close to food outlets.",child,0,0,1,0,0,0,disputed
5517,"Great location and a very friendly, helpful staff. Immaculate room and hotel with all the amenities one could ask for. The morning breakfast changed its entree every morning and the coffee was delicious and available all day. The housekeeping staff is very thorough and the room was beautiful. I would highly recommend this Hampton Inn to anyone looking for location and an extremely clean and well appointed place to stay at a very affordable price. This will be our go to hotel whenever we visit family in Maryland.",child,0,0,1,0,0,0,disputed
3686,"We only had two days to spend in Baltimore so I chose this hotel based on it's location. It was even better than I anticipated. Walking distance to Fell's Point. The room was spacious and well appointed. It was loud in the morning with breakfast in the lobby and housekeeping starts knocking at 8am sharp. They'll keep knocking too which was irritating so if you want to sleep past 8 put the privacy card on your door handle. Breakfast ends at 10 which I wasn't told at check-in and didn't see in writing anywhere so we missed that the first day. We were there for crabby hour and it was delicious and a nice touch to the stay! I saw other reviews complaining about parking, we didn't have an issue. There's a lot and a ramp right next door.",handicap,1,0,0,0,0,0,disputed
3552,"Great hotel for price. Large rooms with good views. We had small toddler and he had room to play and climb--very spacious! Room was very clean and hotel staff was great. Nice breakfast (eggs, waffles, French toast, fruit, yogurt). Everything was great, but the pool. Pool was extremely small and was greenish in color. I was surprised at how small it was. Other than that, great hotel for the money and it is close to the inner harbor and National Aquarium. Don't valet, as they charge 42 per day. Garage behind hotel was 3 on the weekend and we parked there 20+ hours. During week it was only 14 to park overnight.",child,0,0,1,0,0,0,disputed
3558,"Excellent service, great size rooms and great location for my family to stay while I had surgery.",child handicap,1,0,1,0,0,1,disputed
7214,For some reason according to the front desk the regular queen room booked from Hotels.com gave us a handicap room. I stayed at a wonderful Red Roof Inn in Boston a few years ago. Since then i have been to 2 in Pennsylvania. It is definitely not the same. Won't be staying at red roof again,handicap,1,0,0,0,0,0,disputed
1191,"Tried out Aloft for the ADA rooms. Pleasantly surprised spacious rooms updated features. We will look for the brand in our travels. The receptionist was very friendly and knowledgeable of the area. I was waiting for the concierge to give a breakfast recommendation and she was busy so the receptionist gave us a few with different styles and directions turned out great. Thank you Aloft for a great stayDelighted to hear of your stay with us and appreciate your feedback on our ADA rooms. We hope you will stay with us again in the future,Dixie Krauss, Assistant General Manager",handicap,1,0,0,0,0,0,disputed
3817,"Bad: Check in time inaccurately published,I saw o artival it is betw. 9 am and 11 pm.Important to know for Late arrival. Not suitable for people with mobility issues. Good: Good location",handicap,1,0,0,0,0,0,disputed
2495,"We stayed here for one night on our way to Northern Virginia with our son's and their families. This is one of the better hotels we have stayed in with the free drinks, free dinner and free breakfast, it can't be beat. This hotel is super clean, allows pets, and is in an easy on and off from I-77. There... More",child pet,0,1,1,0,1,0,disputed
9861,"The location is excellent. It's right across from EAA and right by the outlet malls. Tons of restaurants within a 5-minute drive. The hotel room itself was bigger than expected and had comfortable beds. Although I didn't use the pool area, it looked nice for kids. The hot breakfast was OK. The thing that knocked it down to 4 stars... More",child,0,0,1,0,0,0,disputed
8682,"The hotel has lovely quiet rooms always cleaned and polished. The staff are friendly and efficient. Even on busy memorial weekend the place did not feel too crapped or rushed. It's sad to see their luxury 'Skies' rooftop revolving restaurant has gone bust.We had to eat dinner the first night at the 'Spectator's' bar which was awful. We went back for drinks later at night and the main bartender was rude, he fitted right into the ambiance of this nasty little nugget.The breakfast buffet is always one of the highlights of my stay at this establishment. It's reasonably priced with top quality selection and service. The terrace view is calming with all the trees and water fountains babbling in the background.The pool was just 'remodeled' for memorial weekend but as always it was over packed and there were about 15 chaise lounge chairs for a large hotel. The hotel must buy some chairs for the clients. We had to sit on the concrete both days with our 2 year old. Next time we will bring our own chairs.I talked to the staff who said the entire hotel is in a remodel phase and I'm sure they will address these minor details. I may have griped a bit that I still love the hotel it just needs some minor adjustments. If your with family and need a dinner just go down to the Westin through The Link they have a bar/restaurant that actually has main courses and cooked food with vegetables.",child,0,0,1,0,0,0,disputed
6056,"Hands down, the best hotel I've ever stayed! Helpful and friendly staff. Cozy and well kept rooms. The atmosphere is warm and inviting. Also, very easy to get to. The wait staff at the Irish Pub attatched to the hotel makes you feel a part of their family. I can't wait to come back!",child,0,0,1,0,0,0,disputed
7375,Rooms were bigger than expected and five of the rooms we booked had a lounge bench. Staff allowed the use of breakfast room for a late meeting. This is a no smoking and no pet hotel. Breakfast was basic cold continental. Great rate.,pet,0,1,0,0,0,0,disputed
1465,"This hotel was fantastic. The hotel is clean and organized. The staff are very helpful, patient and know their jobs well. I was on my own with my son and the staff recommended top places to visit, as well giving me suggestions in saving some money too. Mary-Angeles, Joy, Patrick, Adriana, Domi, Catalina, Ashley--- Oh boy I could go on! Genuine people who treat you like you are part of a family. I will always come back here again. I would definitely recommend this place to anyone and everyone. We had a wonderful time here and the memories we made are precious. There are not enough words to describe just how caring the people here at this hotel. Please take my advice and come here- you will not be disappointed.Thank youDear Leticia, Thank you for sharing your experience at the TownePlace Suites Anaheim Maingate Near Angel Stadium.With a mission to provide superior customer service, we take great pride in serving your needs and are delighted to hear that we have met your expectations. As a valued guest and Marriott Rewards member your feedback will be shared with the team to continue to inspire and motivate them to deliver exceptional customer service. Thank you for staying at the TownePlace Suites Anaheim Maingate Near Angel Stadium and we hope you choose to stay with us again whenever your travel needs bring you back to Anaheim. Sincerely,Mary Angeles-ClementeAssistant General Manager TownePlace Suites Anaheim Maingate Near Angel Stadiummary.angelesmarriott.com714.939.9700",child,0,0,1,0,0,0,disputed
164,"Bad: 1st - PARKING LOT **BAD,BAD,BAD** This is 2017, nobody need driver to parking car, unless you're 85 yrs old (should not even drive). But drivers that steals quarters from your rental car, this is very low. 2nd - They asked a deposit of 100. Because I was planning to get it back, I used a BC and not a CC. On check out I was informed that it will take 1 to 2 days. Should I trust on it 3rd - If you sleep on that room 512 and need a AC on, make sure you are deaf or use to leave near NY freeway. The noise of that machine it's worst than sleep on LV international airport at 9am with your windows car open. Will I stay on this hotel again NEVER. Good: Location, access to shopping, and cleanning",handicap,1,0,0,0,0,0,disputed
5270,"My family stayed here during my niece's wedding and really enjoyed it. The rooms were clean, large and contemporary in their decor. The beds were VERY comfortable as well. The free morning breakfast was AWESOME - complete with made to order omlettes, pancakes / waffles, fresh fruit more. I also thought the service was great. My elderly dad has... More",child,0,0,1,0,0,0,disputed
1477,"The rooms were very spacious and clean however, very noisy being on the second floor. Kids jumping and running all hours of day and night. Front staff were very helpful and the breakfast was great. Shuttle (ART pay as you go or get a pass at the office) was just outside the door as was Denny's and Starbucks. Not the usual Mariott standard though. Older- small pool. --Hence the 3 star.Dear Valued Guest,Thank you for your review. I am sorry to hear that we did not live up to your expectations. Please feel free to contact me personally to discuss your stay in more detail so I know how we can turn your three into a five.Hospitably,Greg WilliamsGeneral ManagerGreg.WilliamsMarriott.com714-939-9700",child,0,0,1,0,0,0,disputed
6327,"Renovated room was very nice. My request regarding a room on the first floor and close to where I would unload... handicap if possible... was met in all respects. Breakfast was hot and fresh, with all the usual items! Personnel were friendly and helpful:-)",handicap,1,0,0,0,0,0,disputed
5151,Arrived and had prev reqd a king or queen suite and was given a wheelchair accessible dble. And was told that's all they had. However a couple that were friends of mine later called and made a reserv and recvd a king suite! Additionally our heat was broken all week end and it was quite chilly. They attempted to repair twice w/no luck.,handicap,1,0,0,0,0,0,disputed
7113,This is a nice family owned hotel. It is well appointed but not luxury. The service was exceptional. They could teach a course in hotel service. The staff introduced themselves and remembered our name.,child,0,0,1,0,0,0,disputed
1203,"Great location a block off canal and just outside French quarter, very nice rooms, spacious, not much privacy in bathroom space and somewhat see through shower glass pane into main room. Would be more ideal for couples then friends/family. Overall great atmosphere. Very happy, would book again.Thank you for taking the time to share your review of our hotel. We do have a bit of flare in the most of the bathrooms as you alluded but we certainly have rooms with a bit more modesty available, please be sure to note and request that when you book next time!See you soon,Dixie Krauss, Director of Operations",child,0,0,1,0,0,0,disputed
2775,This hotel is a great place for a relaxing family getaway. Just steps away from the soft sand beach. The pool is great. The staff are professional and friendly. I am particular about cleanliness and service but found this hotel satisfying in all areas.,child,0,0,1,0,0,0,disputed
688,Bad: assigned an accessible room without being told. tried to book room direct with hotel but was told tat they could not match thebooking.com rate (even though we were starwood members.. ). Good: bar area,handicap,1,0,0,0,0,0,disputed
9483,Awkward and inefficient front desk staff. Worst check in I've experienced. Hotel is dirty and room smelt like a wet dog. Fire alarm cords hanging from ceiling (with no alarm) and plastic cup secured over fire sprinkler.,pet,0,1,0,0,0,0,disputed
7789,"This place was horrible! They are being completely remodeled so there hasn't been any general maintanance for awhile you can tell. Also, none of the staff we encountered should even be working in the hotel/service industry, no clue about their job. No pool, only a couple floors even have rentable rooms, poor selection for breakfast, all starchy items not even any fruit, and no internet in the so called business center! They could at least have put a sign on the door. We were going to do our air check-in one morning and couldn't, if we had known the night before we could have planned something else. Really awful. We had several other family members there as well. Hotels.com shouldn't even have them on their list. The photos do not portray what it is now. Bottom line-DO NOT STAY HERE!",child,0,0,1,0,0,0,disputed
4106,"Room was too expensive. No full or continental breakfast. Staff a bit laid back. Breakfast was offered on site, but you paid for it. Excellent Restaurants nearby, Denny's and Willie Bird's for dinner. Cost much more for breakfast than normal. Location was OK. just off the freeway (101 North). Shower was very hard to turn on and I had to... More",pet,0,1,0,0,0,0,disputed
4246,"Affordable, clean, excellent views to the pool and beach. Loved the music and happy hour along with family environment. Just wish there were handicap ramps to the pool/beach. There are two staircases to get to the beach and with physical limitations it became challenging to get there. Although once in the beach it's a short walk to the shore. Overall... More",child handicap,1,0,1,0,0,1,disputed
2936,Room was comfortable with a lovely view and well lit with natural light.it is quiet and nearby are some very good restaurants. Great location for family vacation. Will return wherever we visit Boston again,child,0,0,1,0,0,0,disputed
9620,"Doors started slamming, a toddler screaming and a little dog yapping at 6:00 on a Sunday morning! The owner got the dog under control, but the doors slamming was a constant problem. (Not only the noise, but the shaking of the walls bed when the doors slammed. Also, our room door rattled when someone else slammed their door.) The... More",child pet,0,1,1,0,1,0,disputed
1745,"We were in town to visit with our daughter and also see my brother. We stayed at the Hyatt House. The staff was friendly but not very empowered. Their directions on the ways you have to use the room key in the elevator and room were not very clear. We heard that over and over again as we went up and down the elevator with other visitors. The room had strange windows that looked out to the hotel interior. We missed having a window to do a quick weather check. The bathroom was spacious but had the most non-ergonomic faucet. Turning it on meant bumping your hand on the lighted mirror above the sink and that was unpleasant. All the elevators stopped working at one point and the staff only offered a free bottle of water despite the significant challenge for the hotel visitors. I observed a person in a wheel chair as one example. No help was offered for getting yourself or luggage to and from the lobby (besides a free bottle of water from the lobby shop). Although sometimes things happen, it is how the staff responds and this was a major disappointment. The free shuttle will take you up to 1 mile away if it is available or you can wait. The breakfast buffet was good, but they did not always restock items (including coffee lids) in a timely fashion. I don't recommend this hotel.",child handicap,1,0,1,0,0,0,disputed
6988,Rats running around the parking lot. My husband and I saw FIVE rats running around the parking lot and one jumped out a trash can. I don't do rats I am always been afriad of rats and I wasnt expacting that. I didn't feel comfortable staying there. Management was'nt helpful at all. I was there for my son's graduation from the Navy he had completed boot camp. So this was an important visit. We had to find another hotel at night and I had to pay more money.No one was helpful to us at all.,child,0,0,1,0,0,0,disputed
1090,"I went to Chicago last weekend for the Ryder Cup (Golf Tournament) and everywhere I usually stay was completely booked! Rooms were going for crazy rates, so I started seeking out some options that were 'off the beaten path'. I discovered the Central Loop Hotel, and I knew where it was, as I used to walk by it from time to time when I still lived in Chicago.The hotel is very well kept, and has cheap valet (34/night with in-and-out access!). THe check in process was a little strange to me because you check in using a machine like you would at the airport. Some people might love this - but i missed talking to a real person. The machine printed my room info and key card and I headed up to my 6th floor corner room.This room was perfect for my needs. Very comfortable bed, sparkling white linens, beautiful widows that overlooked some fantastic Chicago architecture (post office). But - this room was TINY! Again, it was just me and I knew I would only be spending time in my room sleeping, but the bathroom was very small (no tub, shower only) and the closet was tiny. Almost felt like a ship's quarters. If you are going as a couple, or even attempting to bring kids I would def. upgrade to a larger room or suite. The rooms have free wifi (yeah!), lots of cable channels, free in room coffee and a friendly concierge staff. Free bottled water stations on each floor are also a nice touch.I will stay here again if I'm traveling alone.",child,0,0,1,0,0,0,disputed
6080,Loved this hotel. Great rooms and staff. Pool area is nice and it's available for use at anytime.the one time it rained our family went into the lounge area and the staff was ok with it. So much to do within walking distance. Great location.,child,0,0,1,0,0,0,disputed
2942,Very nice funky industrial hotel. Greeted by cute little pup at the counter. Overhead shower was best experienced in a hotel. Honor bar not necessary for us - stayed with my UW-Madison student one night for orientation.,pet,0,1,0,0,0,0,disputed
6208,Excellent customer service. The purpose of my trip was getting surgery at LSI and the staff at this hotel location was spectacular! They could not do enough for me and my family. Thank you to the entire staff!,child handicap,1,0,1,0,0,1,disputed
3853,Great restful and roomy. Pet fee was way too much. Will cause us not to stay there. Sad. Really enjoyed the service staff. Breakfast was great.,pet,0,1,0,0,0,0,disputed
8569,"We have been staying at TTL for years. Lisa and Ron are the owners and they are like family to us. The Units are always clean, have amazing views of the Town, have full kitchens and they allow dogs. I have never had a bad stay at this Lodge. My wife and I have brought several friends and family to... More",child pet,0,1,1,0,1,0,disputed
9873,"Nice room, quiet, decent TV (not HD) Wi-Fi was good. Not sure if it had the advertised Queen bed, we were snuggled together and we have a queen bed at home. , We choose the handicapped room, no tub. The shower (handicapped room) is nice if you have bad knees as it's a walk in, no step. But the shower... More",handicap,1,0,0,0,0,0,disputed
1495,"We stayed here for a trip to Disneyland. The good: 1 bedroom suite was very large. The bedroom area was small but the living area was huge. Great working/desk area and very nice kitchenette with a nearly full sized refrigerator, small stove, microwave, etc. Some things were recently renovated and looked very nice. The staff was great, helpful and friendly. Location was great, lots of stuff nearby, on the ART route to Disney and close to freeways. Breakfast was small but a decent selection - the waffles were really good and they had trays so that you could take food back to your room. The bad: some parts of the hotel have not been renovated, so there is a mix of new/nice and old/run down in the same room (i.e bathroom counters were nice, but the rest of the bathroom was dated. Old dresser in the bedroom, but tv's were nicer. The carpeting was old, and the door to the room was worn and actually had some non matching paint spots covering some type of damage, but the kitchenette was very nice as was the desk area and newer cabinets that were part of the desk area. For having a large living space, there wasn't a lot of seating. So, there was a small sofabed, and a table with just one chair. It would be nice to have the table and 4 chairs so that if multiple people are in the room (a standard family) there would be places to sit as the couch would only really fit 2-3 people. the other bad was that while I booked the room using Marriott points and was told that they would only place a 40 hold for incidentals on my credit card, the system automatically puts a hold for 170 for each night of your stay, unless the clerk removes your card info and overrides the system. I didn't know this until i looked online at my credit card account. Fortunately, Sam at the front desk was great and got the hold for the first night removed and made sure that no hold was placed on the 2nd night. Still though, unsettling to have some unexpected holds on your account. I've never had that happen at any other marriott property. I also had trouble connecting to the wifi, it kept giving me an error that I couldn't log into the wifi with my room number and last name. But, it actually still connected me on all devices I tried, so I just ignored the error and it worked just fine.Martha C.Thank you for taking the time to review your recent stay at the TownePlace Suites Anaheim Maingate. We appreciate your kind words regarding your satisfaction with the friendly staff, amenities in the room, and overall location of the hotel. We pride ourselves on being able to provide you with a wonderful experience and we are happy to hear that you would return to the property on your future visits to Orange County.I apologize that you experienced a few issues during your stay, but am glad to see that we were able to resolve those during the few days you were visiting with us. Thank you for giving us the opportunity to WOW you in the future and please feel free to contact me directly if you have any further questions or concerns.-Adam",child,0,0,1,0,0,0,disputed
4904,We had a great experience at this hotel. Everything was clean and in good working order. The staff did everything well. The breakfast was all fresh and tasty. Overall a great job supporting my family.,child,0,0,1,0,0,0,disputed
3186,My family and i enjoyed our stay. The room was clean and comfy. The staff was very professional and polite. Breakfast was delicious.,child,0,0,1,0,0,0,disputed
5949,"Once again we were treated to pure luxury at the Bardessono. Welcomed with Family Hill wine, an in room massage and comfortable surroundings, our 3rd stay was exceptional. Anyone looking for that little bit of extra will not be disappointed. The bathroom is huge sporting a jet tub and super spacious closets, two separate sink areas and huge step in... More",child,0,0,1,0,0,0,disputed
7137,We interviewed many companies to find the perfect stationary. Kristen cane to our house to show us her product and it was exactly what we were looking for. Kristen was easy to work with and I have to admit we were not the easiest customers as we knew EXACTLY what we wanted. She... Read More was able to live up to our expectations. I would recommend The Silver Starfish to anyone!,handicap,1,0,0,0,0,0,disputed
7134,Check in kid was motivated and high energy. while this sounds stupid I found it entertaining and welcoming.,child,0,0,1,0,0,0,disputed
5818,"A single parent traveling with two children. I felt very safe. This hotel centrally located to everything. The room was very well kept. This hotel does not rate on the same scale as a five star hotel, but it does rate 5 stars for the kitchen facility, pool area and friendliness of staff. Book with confidence.",child,0,0,1,0,0,0,disputed
3335,"Perfect for a family of four on Chincoteague. Clean, friendly, well-appointed, convenient to everything. A no-hassle getaway for a holiday weekend.",child,0,0,1,0,0,0,disputed
1379,"The hotel seemed old and when I checked into my room there was a dirty rag left on the counter in the bathroom. In addition, there was mold around the handicap bar at the end where it meets the wall. When I checked in the hotel they could not find my HH.",handicap,1,0,0,0,0,0,disputed
5303,"In town for family hospital emergency. Staff was so helpful, extended my stay. There were no rooms in this small town due to graduations, weddings etc. General Manager made sure I had a room. Excellent customer service.",child,0,0,1,0,0,0,disputed
