id,review,category,kw_handicap,kw_pet,kw_child,bert_handicap,bert_pet,bert_child,validation_status
7063,"Good place overall except the carpet in the room was coming loose and bubbling up, great location nice indoor pool, big room, the wifi was extremely slow, the hiking trail was nice the playground needed a lot of work, beds were very comfortable",child,0,0,1,0,0,0,disputed
8230,"My family I stayed the Neptune hotel. The Neptune hotel was a nice place to stay. It was a spacious room for all of us. And most importantly the hotel is right off the beach! You get to wake up to the ocean :) Yolanda helped us check in, she was very nice and helpful. I'd stay there... More",child,0,0,1,0,0,0,disputed
1159,"I coordinated a group of 23 visiting Napa during the grape harvest in October, and we booked the entire group into the Best Western Plus Inn at the Vines. First, let me say if youre a snob and really into posh places with fancy marble lobby floors, fluffy robes on the hook, perky concierge behind a big desk, etc. this may not be for you. But if you like to get real value, service and comfortable accommodations for a modest price, you cannot beat the Inn at the Vines. It is family owned and operated (several generations), and the service and sense of community are notable in this day and age. The place has been updated and has all the features you need..clean well furnished rooms, flat screens, very comfortable beds (we had king bed rooms), great towels, and organic soaps. To some earlier reviews about highway noise: we found it minimal and no one in our group complained. Yes, I did hear the occasional truck early in the morning or California kid with a Flowmaster exhaust doing a jack-rabbit start from the intersectionagain it was not a problem. Ask for a room in the back of the hotel. Front Desk Manager Shanirra did an exceptional job booking our customized winery tour, restaurant reservations, and balloon rides. As our person on the ground in Napa she was in our corner every step of the way and played a large part of a successful three days in Napa! At the front desk Melody, Shawn and Bertha were always helpful, upbeat and service-minded. Complimentary hotel breakfasts are a joke at many hotels.not so at the Inn at the Vines. There is a Dennys on the property, and you get a legitimate complimentary hot breakfast at the restaurant not some dinky room off the lobby. Try eggs any way you want, bacon/sausage and pancakes/toast and coffee. You cant beat it unless you must have Eggs Benedict and mimosas. The owners are continuously making improvements to keep up with newer hotels. During out stay a fitness center and business center were under construction. Botom line: when visiting Napa in the future I will stay at the Inn at the Vines again. Our entire group was pleased.Ed,it was a pleasure meeting you and hosting your group for your stay in the Napa Valley. I enjoyed hearing your story of what happened at the Castle. Yes, Shanirra is a great employee who is always the first to try out new restaurants and tours. All of our employees keep up to date on all there is to do in the Valley. We are family run (4th generation), and as you saw, we take pride in our Hotel. I am glad your group enjoyed their stay and maybe we can make this an annual event.",child pet,0,1,1,0,0,0,disputed
3910,This is our second family reunion there and both times were wonderful. It was peaceful and beautiful. The courtyard had barbecue pits and the condos were well stocked. We sat on the patio most of the time and just visited. A marvelous place to stay when in a group. A little pricey but still a good time. Just off the... More,child,0,0,1,0,0,0,disputed
763,"Nice spacious rooms, good location . The only thing bad about it is that they don't have buffet breakfast and it takes lot of time to get a table and it becomes quite expensive too. 2 of the mornings, I was offered high chairs of bar for breakfast which is not ideal when you pay about 60 dollars for simple omlette, juice and black coffee. But overall very good.Dear neeraj821,Thank you for taking the time to review your recent stay at The St. Regis New York, and thank you for your comments regarding breakfast. We will share your feedback with our team for review, and appreciate your thoughts. We hope to see you again soon.Kindly,Octavia MargineanHotel Manager",child,0,0,1,0,0,0,disputed
4562,"Made reservation here based on reviews, so writing a real review. Stayed in room 204 with family of 4 for one night. The good, no bugs. The bad, smelled of mold/mildew, water stains on ceiling, stained bathroom towel, greasy tv remote, dirty tub, old tatered carpet overall dirty run down feel. The mattersses where in good shape. One of my... More",child,0,0,1,0,0,0,disputed
7834,The location and view were very impressive with very large pool and playground. The stream flowing around the facility was spectacular. The staff was very friendly. The rooms were very run down and gloomy. Our sink stopper was broke which was taken care of right away but carpet was very nasty. For what I paid I expected much more.,child,0,0,1,0,0,0,disputed
8504,"Awesome free breakfast with different hot items each day like bacon, eggs, sausage, hash browns. Waffles, oatmeal, cereal, muffins, yogurt, etc. Kids loved the nice pool and enjoyed getting hot chocolate.",child,0,0,1,0,0,0,disputed
5223,We stayed at the Holiday Inn on a weekend shopping trip to NYC. Our flight arrived at 8am and was traveling with my 3 month old baby. They let us check in early which was nice. It was very easy to go to NYC #320 bus just outside the hotel with a 20 min bus ride to Port Authority. Wifi could not access from our room had to go to lobby to get internet. Other then that it was good. Lots of dining options just outside the hotel. Walmart 5 min away. Would stay there again.,child,0,0,1,0,0,0,disputed
3904,"Took daughter in law and two granddaughters ..great for families , fantastic breakfast, very nice staff . Location of room was really nice, beautiful view of the red mountains.central location for walking, shopping and dining.",child,0,0,1,0,0,0,disputed
8361,This is our second time here. We love it! The cabins are so nice. The staff is excellent. Putt-putt course is recently renovated. Quiet area surrounded by ponderosa pines. There are a few pet friendly cabins. Call ahead to check availability. Those cabins look the same as the others. Those cabins do have a cage on the side near the... More,pet,0,1,0,0,0,0,disputed
6533,very nice resort to spend a weekend with a family or just someone special rooms are very nice. around the resort very nice volleyball and small sandy beach but also nice fire pit for the evening. and easy to get to the dells from here. its a must place to check out.,child,0,0,1,0,0,0,disputed
3130,"We stayed in this hotel while traveling back to Florida....it was very nice... The rooms were clean, very nice carpeting and comfortable beds....we had an adjoining room with my daughter who had a dog with her. The rooms were a tad small...not a deal breaker... Each room had a microwave and fridge.. I would stay here again, it was very... More",child pet,0,1,1,0,1,0,disputed
7584,"The hotel made a mistake when I called for a handicap room. The room we had to settle for had one king bed instead of two beds as requested as this was the only handicap room available. The manager arranged to have a cot brought in, which we agreed to. However, we decided not to stay the second night. I... More",child handicap,1,0,1,0,0,0,disputed
2332,Pets are allowed. You do not know which rooms they allow Pets. I was awakened my first evening four times by two pit bulls barking beside me. Staff moved us to different room next day. Valet parking is too expensive. Rib Room prices are also too high. Rooms with a balcony are the way to go. Good Location for Hotel.,pet,0,1,0,0,0,0,disputed
7992,"The motel is being redone, so it was a little messy. My room was all new, and the mattress was wonderful! I have a bad back and knees but after the second night I walked out carrying my cane! I need to know what kind of mattress you are using. If you weren't so far away I would just move... More",handicap,1,0,0,0,0,0,disputed
382,"Our stay at the Ocean Tower Hotel was amazing! I read one review that didn't understand why this hotel had such good ratings. Well, he must be used to spending 200+ per night for a hotel room, or never traveled to Hawaii. Hotels with this location are often 300+ per night. The reviewer mentioned it being in need of a remodel. Well, unfortunately for those of us used to watching how we spend our money, they are remodeling the hotel and the rooms look awesome!!! They look nicer than the Arizona Biltmore and Phoenician Resort in Scottsdale, Arizona if you have been there. (I had only worked there and got the view the rooms, as I could not afford to spend 400+ per night.) So, when the rates are higher, and in line with the majority of the other hotels, that reviewer should be happy because the new rooms are truly gorgeous. People pay for gorgeous. They are the most modern beautiful hotel rooms I have ever seen.We actually felt lucky to get to stay there before the major remodel. The location is so close to the beach and downtown activities. We could walk to all kinds of wonderful things to do and see. Diamond Head was our view out our bathroom window. I would recommend spending the extra 15 or so per night for the ocean view. So, it wasn't fancy, but it was fun and helped us be able to save quite a bit of money. The bed was comfortable, the ocean breeze was to die for, and we couldn't have asked for more in that price range. I also have to recommend a corner room if you get lucky to have a cross-breeze of ocean air.However, what made it the most wonderful stay was the staff. We were treated like family from the moment we arrived. We never felt so cared for in a hotel. The friendly, caring and attentive staff made it a 5 star hotel in our eyes. We cannot wait to go back and see all the friends we made there. If on a budget get in on the older rooms before they are remodeled. If you have the extra money, get an amazing remodeled room, you won't be dissappointed.",child,0,0,1,0,0,0,disputed
3401,"Previous reviewers have nailed it....nice property, good location, attractive but crowded pool with tons of kids. We did swim at the beach right by the resort but there's not really a big enough flat area to set up/relax there. Rented via vrbo and got a decent price. Actually enjoyed our mountain view quite a bit- fun to watch the sun... More",child,0,0,1,0,0,0,disputed
4577,"We stayed in double queen. It was very spacious. The neighborhood was great. Felt very comfortable there. It's a nonresidential area by the freeway with restaurants nearby. The freeway was a little loud in the mornings and there was some construction going on right outside the hotel. They should be done with the construction there in about a week. It woke us up very early one morning. I told the manager about it and he was happy to switch our rooms if we wanted. We chose to stay in the same room. It was less noisy the next morning without the jackhammer going. The kids even enjoyed watching the big excavator going. The even numbered rooms may be less noisy. Breakfast was decent. Scrambled eggs, sausage, potatoes, waffles, cereal, and donuts. The indoor pool is small. It would maybe fit 15-20 people. There were 12 people when we went and was already getting crowded. Exercise room has an elliptical and recumbent bike only. The staff were very nice. We would stay there again.",child,0,0,1,0,0,0,disputed
6033,not able to check in till after 4:30pm and had to acquire hotel manager in order to get in even at that time. We then were given a room with i think handicap shower...had no tub..water went on floor...upstairs must of had the same because their water dripped from our ceiling,handicap,1,0,0,0,0,0,disputed
1183,"We stayed here before a Saints game with kids. Pros: Location was perfect for this - room was clean and large and the kids loved the games in the bar. The bar staff was particularly helpful and friendly. Cons: the front desk is understaffed and really slow, both check-in and check-out. The breakfast area ran out of almost all items and closed early. The hotel screwed up our pre-arranged late checkout and locked us out, and then gave us the wrong key TWICE. Long story, but the whole mix up ended up costing us 45+ minutes.Well that's certainly not the experience we hope to provide. We will be sure to share your feedback with our front office to ensure this is not an ongoing issue. We do hope you give us another shot next season! WHODAT!!Dixie Krauss, Assistant General Manager",child,0,0,1,0,0,0,disputed
9573,"We stayed here while visiting family visiting the wine festival. The hotel was clean the staff was very friendly. Even house keeping was great. The 2 negatives, some people were getting welcome bags, while others weren't. There were some people complaining in the elevator about this as we were going to our room. It didn't matter to us,... More",child,0,0,1,0,0,0,disputed
7474,This is the best hotel to stay when you are visiting Laughlin. Their room are nice newly remodeled their pool is nice for the little ones. Also it's got a great view of the river and the stage whenever festivities are going on. Do yourself a favor and stay at the Colorado belle,child,0,0,1,0,0,0,disputed
1305,Hotel was in decent shape and clean.  Bathrooms were very nice and redone but rest of room looked fine.  Main floor smelled of cat litter in some places and some others smelled like cleaning supplies.  Desk staff messed up my room keys when I checked in so I had to go all the way back to lobby to get it fixed.  Staff was friendly and apologized though.  Check out was smooth and easy.,pet,0,1,0,0,0,0,disputed
2088,"The stay was highly satisfactory. We were very impressed with Dan, who was managing the desk. There seemed to be some confusion about the category of room (we were allotted a room meant for handicapped person) but Dan straightened it out within a minute. He was also helpful with neighborhood information. Will stay there if we visit Newport again.",handicap,1,0,0,0,0,0,disputed
1841,"Their is everything for everyone at the Sun Coast. Every amenity you could want or need ranging from small children to adults. From arcades, bowling alleys, and cheap gambling. A very nice place to enjoy Vegas away from the Strip. Also It is right across the street from some amazing golf courses along with shops and fine dining. A very good choice in my opinion!",child,0,0,1,0,0,0,disputed
3008,"Stopped here on my way back to the west coast. Little did I know, I ran into construction on the off-ramp and the intersection just before the hotel. Not their fault. The lady at the front desk was extremely friendly. Although I saw a few dead bugs in the stairwell at the end of the hallway I would definitely stop... More",handicap,1,0,0,0,0,0,disputed
4187,Our room was handicapped accessible yet was located in the most obscure corner of the building on the third floor as far from the elevators as one could get. Seems kind of strange. Check-in process was fast and smooth with no issues room was clean comfortable and everything we needed.,handicap,1,0,0,0,0,0,disputed
1567,Clean room. Great price at 162 a night. Two beds offset so our son was out of the way while sleeping. Clean rooms and refurbished. Close to Disneyland. And my son said he caught a Charmander in Pokemon so he's happy. Great hotel for the price and proximity to Disneyland.,child,0,0,1,0,0,0,disputed
9043,This is a good place to stay if you do not need to be within walking distance of downtown. Quite despite closeness to I-79. Good family restaurant next door. Easy access to Interstate.Room was small but adequate. Shower definitely for one at a time. Staff very pleasant. Cookies at front desk in the evenings were nice.,child,0,0,1,0,0,0,disputed
6822,"Loved everything about it. Rustic feel, but 5-star comfort and great staff!! Will definitely visit again, next time for a longer stay. Not a great place to visit with little ones, but for a couples retreat it is fantastic. Thee was a wedding there when we visited and they dominated the Hilltop Pool (and they were very LOUD) so we... More",child,0,0,1,0,0,0,disputed
3422,"We (family of 4 including two older teenagers) love Maui and have stayed at several hotels and Villas on the northwest coast. We thought the Westin Villas were the very best until this current trip. The Honua Kai is now 1 in our book for several reasons: 1) Big, comfortable and well appointed units. We had a 2 bedroom with... More",child,0,0,1,0,0,0,disputed
4473,The location of the Charlottesville Hyatt Place is excellent with a variety of food in walking distance. University of Virginia very accessible from this location. Front desk offered directions and guidance.,handicap,1,0,0,0,0,0,disputed
9329,"Rooms spacious, including bathroom. Clean and functioning well. Attentive staff. Very dated decor throughout - distracting, but little impact on our experience there. Requested 2 queen as listed on Hotels.com, but hotel offers 2 DOUBLE beds, which is a significant drawback for our family. Free ear plugs because closing doors are LOUD. That might have been the only downside. Pool and hottub were great. Ample supply of towels with extended access hours as compared to some places we've stayed. Breakfast was good, but crowded. Layout is a challenge when busy as several key items are in corners or nooks. No place to line up but through the dining tables, pathway, etc. Would stay here again if the price were right. Otherwise, would be a more modern competitor with queen beds.",child,0,0,1,0,0,0,disputed
5777,"The hotel common areas look dated and worn. The room had an odor similar to old, rancid grease, especially in the kitchen. Some of the electrical outlets in the room did not work. There is no accomodation for a wheelchair to enter thru the front door. Not sure how they have avoided making the hotel wheelchair friendly. On a positive note, the bed was comfortable and the bedding was cozy.",handicap,1,0,0,0,0,0,disputed
5911,"At the coast for a family event, we needed a place we could trust to be comfortable, accept pet (our cat Ladybug), and leave us enough money to try out another of the resturaunts in Yachats. We've been coming to thr Fireside again again over the years and have been able to count on the place for friendliness, comfort... More",child pet,0,1,1,0,1,0,disputed
805,Bad: Rear and side views from the 4th floor not great. No late night lounge option to have a byob drink with friends and family. Good: Spacious room. Comfortable bed. Friendly staff. Fantastic location.,child,0,0,1,0,0,0,disputed
7093,"My sons basketball team participated in a tournament in Westminster and our organization reserved 30 rooms. The hotel did a great job of keeping us close together and the staff was great. The rooms, grounds, pool and bar were all clean and inviting. The only drawback was the restaurant/bar. I don't think they were sufficiently staffed for a sold out... More",child,0,0,1,0,0,0,disputed
7489,went for a nature getaway. I am disabled and really loved the spacious room that I could get my mobility scooter around in. The staff were very friendly and helpful. They even wash the blankets and covers for each new guest!!And I didn't hear any noise coming from other rooms.,handicap,1,0,0,0,0,0,disputed
9588,"Booked 2 rooms during family trip. Got there late, felt very unsafe, room dirty, had to put towel over desk chair because it was gross. Stayed at other Red Roof locations and when I bring up this location they say they've heard about this location. Yelling, noise, smokey smell rooms (though supposed to been smoke free) but if you saw... More",child,0,0,1,0,0,0,disputed
7233,We stayed at this hotel during the weekend of our daughter's wedding. It was a convenient location to New Albany Links. The room clean and spacious. Hotel staff were very accommodating. And the shuttle to and from the wedding venue was awesome!,child,0,0,1,0,0,0,disputed
8406,"I like the renovated hotel for its small size and location to Old Town. Being a renovated hotel, each room had radiator heat and a standing air conditioning unit both of which can be very loud, but provide some white noise so you dont hear the train whistle. Oreo, the house cat, is a nice addition. The front desk staff... More",pet,0,1,0,0,0,0,disputed
7090,"This hotel was fully adequate for our family. It was nothing fancy but it was absolutely fine for what it was. It's set in the middle of a million other hotels with a Target and Starbucks nearby. Good proximity to various attractions including Disneyland, and Chapman University. Quiet, convenient.",child,0,0,1,0,0,0,disputed
6307,"From the moment I walked in the hotel I was impressed. The cleanliness and decor of the front lobby was very impressing and the friendliness of the staff was very noticeable. I had just had surgery and requested 4 additional pillows at the front counter. By the time we got to the room, the concierge service had already delivered them.... More",handicap,1,0,0,0,0,0,disputed
4080,"This comment is solely based on the Customer Service provided by the night time attendant (ANDREW) that checked us in. I am positive that had Andrew not provided the service when and how he did, I would have called 311 to express my discomfort (caused by other hotel guest) and demanded a complete refund. Andrew the Pena Family thanks you for your understanding and professionalism. -dez",child,0,0,1,0,0,0,disputed
8147,"There is no elevator at this property. Disabled guests will find it difficult to get to any rooms other than those on the ground level. The restaurant is good and the breakfast staff is excellent. A nice view of Moses Lake. The property is not exactly on the main route through the town, but we found that our GPS managed... More",handicap,1,0,0,0,0,0,disputed
3038,The hotel itself is older and the rooms need a few updates . The lobby/pool area is awesome!!!! Great play areas for older and younger kids. Air conditioner super noisy. Beds were very comfy. Great value .,child,0,0,1,0,0,0,disputed
8689,"the hotel was beautiful! the staff friendly but the room was missing a few amenities such as no cream or sugar for coffee. Bell man left me in the hotel lobby with a full cart, 2 kids and a small dog in crate, after i had tipped him to take me upstairs. I had to manage by myself. Manager was very nice and gave us a comp breakfast buffet.",child pet,0,1,1,0,0,1,disputed
3446,"Honua Kai is the best resort i have been too. We originally went for our honeymoon and returned a year later with our new son. We were on the ground floor (rented through KBR) in the Konea tower, next to the coffee shop. The resort is extremely convenient for a stroller/wheelchair access. Dukes on site doesn't offer happy hour snacks... More",child handicap,1,0,1,0,0,0,disputed
6331,2 adults and 1 child the 4th floor. Very clean throughout the room hotel. Staff gave lots of suggestions for places to eat places to visit. Free breakfast until 10am lots of choices. Would definitely stay here again.,child,0,0,1,0,0,0,disputed
2398,"My family found our way to Hyatt Valencia as a result of a catastrophic Gas Well blow-out. Governor Brown declared a state of emergency and more than 4,400 people from my community were relocated to hotels. It was our misfortune to wind up at the Hyatt Regency Valencia. They took FULL ADVANTAGE of the situation, of us, and even the... More",child,0,0,1,0,0,0,disputed
9734,"Room was dirty, black hairs and grass on bathroom floor, tub liner was disgusting, old tube style TV and only had 1 washer and 1 dryer. I have a handicap and was put on the 2nd floor about 11-12 rooms away from the elevator. No luggage carts available which made it difficult for me to bring up my belongings. I would NOT recommend this Super 8 even though it was close to all we wanted to see in the Dayton area.",handicap,1,0,0,0,0,0,disputed
8564,"This hotel has recently had a facelift. My daughter stayed here several years ago, and was very impressed with the update! Quiet, with super comfortable beds. Friendly staff and great breakfast. Easy off and on interstate. Near mall, other shopping district and restaurants. And the price is right!",child,0,0,1,0,0,0,disputed
6849,Our trip was a gift from our wonderful Son to celebrate our 46th wedding anniversay/Honeymoon. Staying at the hotel was absolutely marvelous. All aspects of our stay were well attended and provided for. Something that not too many peope review on is the Island and it's People itself. I have to say that going out from the fantastic resort to... More,child,0,0,1,0,0,0,disputed
7254,We booked at Grand prix Motel last minute for Jeep week 2016. I was a little skeptical due to the stories you hear about outdated motels and the few bad reviews. This is my first time ever doing a review but I felt like this place deserved it. Very well maintained family owned motel with private balcony right on Daytona... More,child,0,0,1,0,0,0,disputed
