id,review,category,kw_handicap,kw_pet,kw_child,bert_handicap,bert_pet,bert_child,validation_status
3435,It was our first time staying at the Honua Kai...We were there for a week....I had my girlfriend and her 84 yo blind grandmother with me...We stayed in a 2 bedroom/bathroom suite (147) on the bottom floor...The suite was well stocked and had high end Bosch Appliances....Be aware that full housekeeping is only every 4th day and trash and towels... More,handicap,1,0,0,0,0,0,disputed
4611,"Our party of 4 adults and 1 child had plenty of space to spread out and be comfortable in the spacious 2-bedroom suite. Friendly, courteous staff. Excellent amenities, including executive putt-putt course, TV club room, 24-hr convenience shop, and business center. Good breakfast and complimentary internet was a plus. An all-around pleasant hotel stay.",child,0,0,1,0,0,0,disputed
1732,"A standard not fancy hotel that provides a little privacy and extra space at a good rate if you want an affordable suite. Decent pretty big breakfast buffet (could someone figure out that 15 of us don't digest dairy and really like having something like soy or almond milk). little pool only good for kids. Nice big lobby and lounge areas.Jesse L,Thank you for choosing to stay at Hyatt House during your recent trip to Seattle and for taking the time to share your experience on TripAdvisor. We value the feedback from our guests and are always striving to improve our guests stay. Please let us know when you return as wed love to welcome you back as our guest.Sarah Junge",child,0,0,1,0,0,0,disputed
1071,"We finished business outside Philly early and took a chance on a room at Home2. Friendly front desk had 3 of us checked in within minutes. Large, clean, well-appointed suite with comfy bed and enormous bathroom awaited us. Perfect location to walk to eat, shop, catch a train for other points within Philly or direct to airport. My flight was delayed and they provided me with a late check-out no problem. Plan to return with my family! Definite yes for anyone staying in Center City.",child,0,0,1,0,0,0,disputed
9455,"We stayed overnight to prepare for my daughter's bridal shower. Having a full size refrig was great for storing all the cold food needed for brunch. The room was clean, quiet and smelled great. Easy check in. Would definitely stay here again.",child,0,0,1,0,0,0,disputed
2783,"Birthday's, Anniversaries, Guys weekends and family visits all have been celebrated at the Chart House. It all started with my girlfriend and I first visiting there in the mid- nineties and now we take our children and our dog with us. The views are some of the best, balconies are huge and definitely used. We just loved all the boats... More",child pet,0,1,1,0,0,1,disputed
1729,"My family and I were surprised at just how good this place is. Given its location right in the heart of Seattle Center and its affordability, we thought for sure something was amiss. Parking in the area is expensive, here it is 25/day with full in/out privileges in a protected garage. The rooms are spacious, with a kitchen (microwave, stove, full fridge/freezer, sink, etc.) with an elevated dining table. Add the spacious bedroom, bathroom, and sitting area and you have a comfortable place for four to stay. The full breakfast is above average but the real hidden gem is the H Bar. We ate here a couple of times and the food is outstanding. The happy hour features a good selection of 3 local tap beers and the place is never really crowded. I'm not sure the tourists know they can come in otherwise I could imagine thirsty and hungry tourists at Seattle Center walking the minute or two to here, having a beer and a bite, and easily going right back to the Space Needle. I searched for the H Bar on Trip Advisor, but it's not there. NOTE TO HYATT HOUSE: You might consider getting the H Bar added as a restaurant if you want to increase your business.Thank you for completing a TripAdvisor regarding your recent stay at our hotel. Please know that your feedback is extremely valuable to us and we will utilize your response to make every guest experience the best it can be. I greatly appreciate your kind words and they will be celebrated with the entire team. If I can be of any assistance to you, please contact me directly. We look forward to being of service to you in the near future. Best regards, Jonathan",child,0,0,1,0,0,0,disputed
1196,"Great vision combined with high energy ,pushing hospitality into a my first stay in this aloft brand . Rates were reasonable. Location was great. Clean room. Large shower . Comfortable bed. Pet friendly. Other than thin walls , was pleased with Staff, modern theme, large clean room and shower area. Great! We have converted another happy guest and we are so glad that you gave us the chance. Thanks for trying out Aloft New Orleans Downtown.",pet,0,1,0,0,0,0,disputed
2509,"Coconut Waikiki is a very nice Hotel, just far enough away from the main touristy areas to suit us. Just make sure when you arrive at the Hotel that you use the ramp(drive way) access and don't try and drag your bags up the entry stairs! Rooms are ample, clean and well maintained. There is also a laundry room and... More",handicap,1,0,0,0,0,0,disputed
9458,"My family and I had a great time during our stay over the Christmas Holiday. This hotel is close to Hershey Park, a really nice Mall with a movie theatre. Tons of dine-in and take-out restaurants. The hotel staff was very nice. The best folks work in the restaurant. They were soo helpful and friendly. The food was great as... More",child,0,0,1,0,0,0,disputed
7231,"Recently, enjoyed with my family and grandchildren 3 nights at this quaint beautiful centrally located hotel. Our room was beautiful and although facing the front of the property, we had a beautiful view of the mountains. The flower boxes were so beautiful hanging on the small patio opening of our room. Hummingbirds flew on the window boxes taking nectar from the petals. It was very wonderful to see. The rooms are large and all accommodations were much like a 5+ hotel. Beautifully decorated we were very pleased with our rooms. We especially enjoyed the valet parking and Eric who was so helpful. The check in process was easy and accommodated our early check-in wishes. The European style breakfast was enjoyable with plenty of food to fill you up for a early day of shopping sight seeing and photo opportunity. Walk literally out the door and you are welcomed by the abundance of shopping and restaurants. We will most certainly book this hotel again.",child,0,0,1,0,0,0,disputed
4343,The staff was very nice but the rooms are just old. Had a strange smell to the room and my daughter actually got congested while we were staying there. It may not have had anything to do with the room but you can't help but wonder. The breakfast was nice. Hotel just needs a major renovation. We felt safe in the area.,child,0,0,1,0,0,0,disputed
8830,"I have stayed at this property each time I visit family in New Jersey. Always very nice with super clean rooms, friendly staff and a great restaurant. Easy to get to and affordable. They have a well sorted Libby with snacks, sundries, business area and the requisite Tvs, lounge area and breakfast space. I'll be back.",child,0,0,1,0,0,0,disputed
1345,This is a very nice hotel in a great downtown location. Accessible to all the attractions and very accommodating. I found it comfortable and clean. I like the complimentary drinks at the door and friendly staff. Our family really felt welcome and enjoyed this hotel the rooms were very relaxing.,child handicap,1,0,1,0,0,1,disputed
7904,"Across from the bus station!!!!!!!!!! Horrible part of town made my family feet very uncomfortable. Halls were littered with trash, carpet is old and stained. This is not Bricktown I don't understand why they are able to use that name. Not even close to Bricktown! Pillows smelled, beds hard, walls are dirty. One of the employees told me they have... More",child,0,0,1,0,0,0,disputed
3063,"Went down for a Giants game and wanted a place to stay within walking distance of ATT Park. I have back problems so I was looking for a short and safe walk. The last time we went down for a game we stayed the Hyatt Regency on the Embarcadero . Just as a side note, we had a fine stay... More",handicap,1,0,0,0,0,0,disputed
1869,"We spent several nights at this hotel. We loved the location about 8 miles away from the strip, but easy drive. You do need a car if you stay at this property. It is far from most everything else. Plenty of places to eat in the area. Located in a beautiful place near golf course. We had a nice view of the mountains and Las Vegas strip. We found it quiet at night, even though we were there over a weekend, and there were families with young children staying at the hotel. The hotel staff was very friendly, and helpful. We found our room to be large, and clean. Bathroom was large and had double vanity. It is not the most fancy of rooms, but it had everything we needed. A fridge, coffee maker, flat screen TV. We ate at a couple of the restaurants in the hotel and they were good, the buffet breakfast was very good variety for the money. We saw a show at the showroom, every seat is a good one. We used the pool which was very nice, not the biggest one but nicely decorated and plenty of seats. Overall very happy and would stay again.",child,0,0,1,0,0,0,disputed
4632,"Well, I'm stayed in much better motels and some worse, though I made do with this one. First off they put me in a room that had not been serviced since the last guest. Walked in and like wow, is someone in here! Obviously they were long gone but not a good feeling. Called the front desk and they put me in another room. My new room seemed clean, though motel in general is a little run down. Motel itself is actually 3 separate buildings and I was in the south one. Area is fine and I felt safe walking around outside at night. Couple of real good honky tonks right next door (recommend Nashville Palace), though down side if you want peace and quiet you won't get it until they close up at around 2am. The outside pool is across the parking lot right up beside a Bar and Grill (Scoreboard - another fine honky tonk), though not like I was going to partake in outside pool in January anyway though is strange where the pool is located. By far the best about this motel is the location. Everything you need is within walking distance. All in all it was okay though not sure I would take family to stay there, though good for just me and would stay there again. All depends on your level of expectations, if they are low to average, you should be fine, if high, go somewhere else. Get what you pay for.",child,0,0,1,0,0,0,disputed
8303,"Newly remodeled, very clean, and wait staff was the best. I will diffently stay again. Highly recommended. Traveled to Big Spring to visit family and attend the Fantastic Forth to see Ronnie Millsap, Great White and Quit Riot. Great place great show.",child,0,0,1,0,0,0,disputed
4495,Enjoyed my time w my family ... The carpets are aging and could use replacement. The pool was enjoyable and loved by all.,child,0,0,1,0,0,0,disputed
1744,"This hotel is the place to be to experience downtown Seattle. The Monorail, Seattle Center, are across the street and the waterfront is walkable or by shuttle. The Light Rail from Westlake Center can take you right out to Sea-Tac. We'll be back!!!Sarah P,Thank you for staying with us next to the Space Needle! We love our incredible location and are ecstatic that you felt the same way. As one of the newest members to the Hyatt family, we are more than appreciative of your feedback and am glad to see you enjoyed your stay. We pride ourselves on our guest satisfaction and hope to see you again soon in the near future.Sarah Junge",child,0,0,1,0,0,0,disputed
5802,"You can walk to Arlington Cemetary the Iwo Jima Memorial from the hotel, as well as to a supermarket restaurants. The hotel shuttle was very reliable, running in the morning afternoon Mon-Fri to from the Metro station once a day to the supermarket. The suites were large, with a pull-out sofa in every room. It wasn't the most comfortable, but it was great to have a separate bedroom area full kitchen. The only thing I was suprised at was the fact that we had to lift our heavy luggage up about 5 steps to get to the elevators. There were no ramps. From the parking lot, it's a straight shot through the front doors of the main entrance. I saw some people arrive by bus, which dropped them off on a side street. They were dragging their luggage up about 30 stairs to get to the parking lot! Instead, they could've just walked around along the street in front of the hotel to get to the lot. Going up all those stairs with luggage did not look fun!",handicap,1,0,0,0,0,0,disputed
1095,"The Central Loop Hotel was in a super convenient location for walking to the Art Institute, restaurants, and shopping on State Street. I arrived by train, and it was just a couple of blocks walk to the hotel. The manager and front desk staff were very helpful and nice. The room was pretty basic, but clean and neat. Felt safe and secure. The only downside was the hotel practice of placing a deposit on my credit card for any incidental charges. I really don't like that practice. I noticed that I was not the only one, another hotel guest was complaining about it at the front counter while I was there. My hotel charges were paid in advance as a birthday gift from a family member, so I thought I was all taken care of, and then found out that I had to give them my credit card just in case there were any charges in addition. Of course there weren't any additional charges when I checked out. I just don't like having to do something like this.",child,0,0,1,0,0,0,disputed
4242,"I visited this hotel about 6,7years ago, It was nice, not sure what happened now.I stayed in the family suite, it was horrible,, one of the bedrooms was so hot,it melted my hair products.. The stairwell smelled like urine and fish. The kitchen stove area was dirty, both restrooms were hot and grimmy.The front of the dresser drawers were falling... More",child,0,0,1,0,0,0,disputed
3441,"My family (including 2 boys, 12 9) shared a unit with my parents we were all extremely impressed with this property There really isn't a bad view from any of the balconies The property is located right on the beach the pools are all very easily accessible from any where. The kitchen was very useful the... More",child handicap,1,0,1,0,0,1,disputed
9747,"If you have traveled down long straight roads for hours and hours and are in need of some rest and comfort with a touch of elegance this is the place for you. Not only is this small family owned motel in pristine condition, but the couple that run it give it an extra special something. As part of a road... More",child,0,0,1,0,0,0,disputed
6606,You can't beat this hotel because it is right on the beach. It is mid beach so away from the hectic and trashy south beach vibe. If you want to escape the incessant pounding music and Kardashian wannabes of the SOuth Beach hotels and neighboring Eden Roc of Fountainbleau then this is a great option. But also don't expect the service of any of these adjacent properties. THe service here is minimal at best. You wait forever at breakfast if you order off the menu. The doormen are non existent as is a concierge. THere is no room service and the food is mediocre. Terrible service out by the pool with a limited menu. No beach chairs - you have to pay an outside vendor. The bathroom was so tiny we could open the door less than halfway because it hit the toilet. Two people trying to use it was like a circus maneuver. It can't possibly be code. There are plastic cups for drinking - no glass but the bed was comfy and the flat screen TV was great. THe staff is not that helpful and the balcony's seem old and in need of paint. We had a gorgeous view but the balconies are interconnected with a rail between them. Our neighbor chain smoked on his balcony which made sitting out extremely unpleasant. That said if you get a good price is really worth it because it is on the beach and that is why I went to Miami Beach in the first place.,handicap,1,0,0,0,0,0,disputed
6850,"Not the quality expected for a Grand Hyatt. Great location to shops, restaurants, beach. Many more children of all ages than expected for this time of year therefore the pool area became less desirable. That was unfortunate because the pool area is certainly one of the main attractions of this hotel. Have stayed here before and do not remember this issue.",child,0,0,1,0,0,0,disputed
1476,"I had planned a last minute trip in to Anaheim to go for a Birthday event at Disney, the entire city was sold out but Townplace had a few rooms available. We generally dont stay this far away from Disney but we had no choice. Room rates were out of control because of a conference and most hotels were sold out! I have to say we were pleasantly surprised with the hotel. My experience at check -in was fantastic, the rooms were clean the energy was good and overall we didn't care that we were a few miles away from Disney. We Were happy with our stay. The only thing I could say that I was not crazy about was the commuter train that passes through the back of the Hotel. Other than that I would recommend this place to any of my friends or family membersWe appreciate your business and value your honest feedback. Your comments have been shared withthe hotel team as a critical way of understanding how we can continue to deliver exceptional serviceto guests like you.Thank you for staying at the TownePlace Suites Anaheim Maingate Near Angel Stadium and we hope you choose to create more memories withus whenever your travels bring you back to Anaheim.Sincerely,Edgar RiveraGeneral Manager edgar.riveramarriott.com",child,0,0,1,0,0,0,disputed
4629,"Our experience at the Homewood Suite was very good. The hotel was very clean. The room we had was very spacious, it accommodated 4 adults 2 children and a puppy. We are very very happy in our choice to go with the Homewood Suite .. Our next trip to Virginia we will stay at the Homewood Suite.",child pet,0,1,1,0,0,0,disputed
6728,Great hotel for the dog owners. The staff changed our room from a handicap room to another room based on our requirements and I thank the staff for honoring our request and needs.Thank you very much.,pet handicap,1,1,0,0,1,0,disputed
5409,Pillows are uncomfortable Spotted babies cockroaches in kitten. No utensils. So prepare to bring things you need.,child pet,0,1,1,0,0,0,disputed
1485,"This is a great Marriott property if you want to be close to the baseball game. I choose this location as it was close enough for me to conduct my business, yet far enough away from my local family Centrally located and surrounded by eateries. Staff at this location are phenomenal and go above and beyond to ensure your stay is pleasant Dear Guest,Thank you for sharing your experience at the TownePlace Suites Anaheim Maingate Near Angel Stadium through the Guest Satisfaction Survey.As a Valued Guest, we appreciate your feedback and are delighted to hear that you had a great stay. With a spirit to serve, we take great pride in not only meeting, but exceeding your expectations. Your feedback is integral to our ability to continue to improve our service. Thank you again for your time and come visit us again soon! Sincerely,Edgar RiveraGeneral Manager edgar.riveramarriott.com",child,0,0,1,0,0,0,disputed
1482,The two bedroom suites worked out very well for kids. Staff of hotel were very helpful. Close to Disney and other attractions. Reasonably priced.,child,0,0,1,0,0,0,disputed
8580,We stayed a night we were on a family trip the stay was so peaceful. The room was beautiful comfy bed and great channels. I would stay again when visiting that area. Also the staff was really friendly and professional.,child,0,0,1,0,0,0,disputed
6478,"No problems whatsoever. Very nice, clean and comfortable. We visit family in Knoxville from time to time. We will stay here again.",child,0,0,1,0,0,0,disputed
2938,"Great hotel with great proximity to Cambridge and Harvard. Restaurants, services and gym are fantastic. Pricey but generally worth it. Connected to large independent fitness club so no fears of arriving in the morning and finding all the equipment taken. Henrietta's Table restaurant is great for breakfast - either business breakfast or with family.",child,0,0,1,0,0,0,disputed
1631,"Perfect for one night visit to tour SDSU. Room was clean, looked newly renovated and very comfortable. Not sure I'd hang out at the pool, though. Double queen room was good for 2 people would have been tight with family of 4. Staff was friendly and courteous. Breakfast was fresh and plentiful. Centrally located to all attractions. Would definitely stay again.",child,0,0,1,0,0,0,disputed
2947,We were excited to stay close to the McClain Center to see our son play soccer for UW. Room was unique but just ok otherwise. Breakfast was terrible and took forever. Waitress volunteered to pay. Would not recommend. The dog friendly thing was a big turn off.,child pet,0,1,1,0,1,0,disputed
1512,"Unbeatable location next to Newbury street. Lovely clean, comfortable room with amenities . Generous continental breakfast. Coffee and tea always available (often with delicious cookies) Very friendly helpful staff. Very easy to come and go as they give you the code. Third time staying here.Thank you for your kind words. We always enjoy seeing you and your family! Looking forward to welcoming you again!",child,0,0,1,0,0,0,disputed
6222,"Cool piece of history, but nicely up to date. Friendly staff and reasonable price. A little of the beaten path but worth looking for. The four of us stayed in the family suite. 2 rooms, king bed, queen/ double bunk bed. lots of room, great mattresses.",child,0,0,1,0,0,0,disputed
1765,"Hotel is situated right next to space needle (major attraction in Seattle downtown). Across the street there is the space needle, the Chihuly gardens, the EMP, and the Seattle center, a lovely park with an amazing playground. Breakfast in hotel was complimentary and was good considering a budget hotel (3 star). The courteous and always willing to serve staff and Chef played a big role. Free 24 hr shuttle within a mile of hotel but sometime wait time is high if you are in downtown markets.Well worth it in Seattle!Devendra G,Thank you for choosing to stay at Hyatt House during your recent trip to Seattle and for taking the time to share your experience on TripAdvisor. We are thrilled to hear that you created wonderful memories throughout Seattle and utilized the amenities within our beautiful new hotel. I will pass on your kind words to the staff, they will all be bursting with excitement knowing they made a difference. We are always trying to leave our guests with lasting memorable experiences. Please let us know when you plan on returning to Seattle as we would love to you welcome you as our guest again!Sarah Junge",child,0,0,1,0,0,0,disputed
4257,Stayed here for our trip to Hershey Park. My son loved the nice and warm pool. Friendly staff and very close to restaurants and grocery store.,child,0,0,1,0,0,0,disputed
7267,"I grew up in Nashua not far from the Crowne Plaza, and finally decided to stay here for the first time in a recent visit home. The grand entrance is still as impressive as it was to me as a kid, although the rooms are basically just your average nice hotel room in this price range. Clean and comfortable rooms,... More",child,0,0,1,0,0,0,disputed
4781,In heart of downtown. Older hotel with front steps that you needed to have bell service for. Breakfast good but expensive. Parking nearby for a fee. Free coffee am only. needs grab bars in bath.,handicap,1,0,0,0,0,0,disputed
1238,"I had stopped by here with my family just to stop by. We did not stay, but rather wanted to see this new property. It is near the Napa River. There is also a Century theater and an In-Shape in the same parking lot. The grounds were immaculate. Once I walked in, all I could say was WOW!. It was beautiful, modern and I felt comfortable as I walked in. We purchased some waters from the gift shop as we were driving around through Napa, Calistoga, and St. Helena. Kalah (I believe that was her name- she had curly brown hair), was so warm upon us walking into the lobby. I asked if I could take a look around just to see what the common areas looked like, she said absolutely! It was beautiful. I am looking forward to my future stay(s) here. I will say as I passed a young lady, Danielle. It was like she did not want to be there or she was having an off day. She did not acknowledge me as a guest as she passed by or even at the desk. Overall still 5 Stars. Kalah (hopefully that was her name) was AWESOME! See you Soon!Dear LeMoura G,Thank you for taking the time to review our Hotel. Your comments especially the Wow are bells to my ears. We truly do have a unique Hampton capturing the Napa Valley throughout the building. It was very satisfying to hear your awesome comments about Kalah. We look forward to seeing you on your next visit to the Napa Valley. Thank you, Serina Najar.",child,0,0,1,0,0,0,disputed
7931,"I got a room on the 2nd floor and when I mentioned about having 2 kids, the front desk person immediately checked and provided a room allotted for handicapped people as it was available. Kudos to her (Couldn't get her name) and it made our stay more pleasant. I will certainly try this place again when I visit this region.",child handicap,1,0,1,0,0,0,disputed
8586,"Amazing place to stay with kids, friendly staff, good breakfast variety. Exercise room was clean and well equipped. Indoor pool very small but correct temperature and Relaxing hot jacuzzi tub. I would recommend this hotel.",child,0,0,1,0,0,0,disputed
